{
  "$schema": "https://json-schema.org/draft/2020-12/schema",
  "$id": "https://schemas.socioprophet.org/regis/search/temporal-fact.schema.json",
  "title": "TemporalFact",
  "description": "A retrieval-plane fact asserting that (entity, relation) holds a value over a validity interval. Facts are the search consumer's projection of the graph's three-time model: valid_from/valid_to correspond to node/edge valid_time.from/to and to the epistemic-edge temporalScope.validFrom/validTo. A fact carries an optional supersession marker (superseded_by pointer + superseded_at instant); the temporal retrieval filter suppresses superseded facts in a high-recall pass and, for a given (entity, relation), rates the maximum-valid_from surviving fact as authoritative. This record NEVER claims canonical truth; canonical supersession lives in the ACR decision ledger and epistemic-edge promotion state.",
  "type": "object",
  "additionalProperties": false,
  "required": [
    "schema_version",
    "fact_id",
    "entity",
    "relation",
    "value",
    "valid_from",
    "provenance"
  ],
  "properties": {
    "schema_version": {"const": "regis.search.temporal_fact.v0.1"},
    "fact_id": {"type": "string", "minLength": 1},
    "entity": {
      "type": "string",
      "minLength": 1,
      "description": "Stable subject reference (e.g. canonical-entity entity_id or node_id)."
    },
    "relation": {
      "type": "string",
      "minLength": 1,
      "description": "Relation/predicate name, e.g. HAS_CEO. The (entity, relation) pair is the supersession key."
    },
    "value": {
      "type": "string",
      "minLength": 1,
      "description": "Object of the relation at this validity interval, e.g. the CEO's name. Carried so retrieval yields an answer."
    },
    "valid_from": {
      "type": "string",
      "format": "date-time",
      "description": "Instant from which this fact is valid (valid-time). Required: a fact with no valid_from cannot be temporally ordered and is rejected."
    },
    "valid_to": {
      "anyOf": [
        {"type": "string", "format": "date-time"},
        {"type": "null"}
      ],
      "default": null,
      "description": "Instant after which this fact stops being valid, or null for open-ended. When present, must be >= valid_from."
    },
    "superseded_by": {
      "anyOf": [
        {"type": "string", "minLength": 1},
        {"type": "null"}
      ],
      "default": null,
      "description": "fact_id of the fact that replaces this one for the same (entity, relation). Presence marks this fact superseded; the retrieval filter excludes it."
    },
    "superseded_at": {
      "anyOf": [
        {"type": "string", "format": "date-time"},
        {"type": "null"}
      ],
      "default": null,
      "description": "Instant at which this fact was marked superseded. Presence marks this fact superseded. When present, must be >= valid_from."
    },
    "source_edge_ref": {
      "anyOf": [
        {"type": "string", "minLength": 1},
        {"type": "null"}
      ],
      "default": null,
      "description": "Optional upstream edge_id / epistemic-edge recordId this fact was projected from."
    },
    "claims_canonical_truth": {
      "type": "boolean",
      "const": false,
      "description": "Retrieval-plane facts never claim canonical truth; canonical supersession is owned by ACR / epistemic-edge promotion."
    },
    "provenance": {
      "type": "object",
      "additionalProperties": false,
      "required": ["source_event_ids", "artifact_ids"],
      "properties": {
        "source_event_ids": {
          "type": "array",
          "items": {"type": "string", "minLength": 1},
          "uniqueItems": true,
          "default": []
        },
        "artifact_ids": {
          "type": "array",
          "items": {"type": "string", "minLength": 1},
          "uniqueItems": true,
          "default": []
        },
        "ledger_refs": {
          "type": "array",
          "items": {"type": "string", "minLength": 1},
          "uniqueItems": true,
          "default": [],
          "description": "Optional ACR decision-ledger entries backing the supersession decision."
        }
      }
    }
  }
}
